agency_cd,site_no,station_nm,site_tp_cd,dec_lat_va,dec_long_va,coord_acy_cd,dec_coord_datum_cd,alt_va,alt_acy_va,alt_datum_cd,huc_cd,data_type_cd,parm_cd,stat_cd,ts_id,loc_web_ds,medium_grp_cd,parm_grp_cd,srs_id,access_cd,begin_date,end_date,count_nu
USGS,05054500,"SHEYENNE RIVER ABOVE HARVEY, ND",ST,47.7027775,-99.9490145,F,NAD83,1548.86,0.15,NAVD88,09020202,pk,NA,NA,0,NA,wat,NA,0,0,1956-04-11,2023-04-30,68
USGS,05055000,"SHEYENNE RIVER NEAR HARVEY, ND",ST,47.7902794,-99.8906815,S,NAD83,1520.1,0.1,NGVD29,09020202,pk,NA,NA,0,NA,wat,NA,0,0,NA,1956-04-10,12
USGS,05055100,"NORTH FORK SHEYENNE RIVER NR WELLSBURG, ND",ST,47.87611636,-99.7184599,S,NAD83,NA,NA,NA,09020202,pk,NA,NA,0,NA,wat,NA,0,0,1958-04-02,1967-03-26,10
USGS,05055200,"BIG COULEE NEAR MADDOCK, ND",ST,47.91945178,-99.5801304,S,NAD83,NA,NA,NA,09020202,pk,NA,NA,0,NA,wat,NA,0,0,1957-03-21,1973-05-09,16
USGS,05055260,"SHEYENNE RIVER AT ST RTE 30 SOUTH OF MADDOCK, ND",ST,47.89055556,-99.5327778,5,NAD83,1405,1,NGVD29,09020202,pk,NA,NA,0,NA,wat,NA,0,0,2011-04-09,2013-04-30,3
USGS,05055300,"SHEYENNE R AB DEVILS LK STATE OUTLET NR FLORA, ND",ST,47.90777778,-99.4155556,S,NAD83,1416.04,0.04,NAVD88,09020202,pk,NA,NA,0,NA,wat,NA,0,0,2005-07-03,2023-04-20,19
USGS,05055400,"SHEYENNE R BL DEVILS LK STATE OUTLET NR BREMEN, ND",ST,47.82138889,-99.2761111,S,NAD83,1399.85,0.04,NAVD88,09020202,pk,NA,NA,0,NA,wat,NA,0,0,2005-07-03,2023-04-21,19
USGS,05055500,"SHEYENNE RIVER AT SHEYENNE, ND",ST,47.8391654,-99.1251227,S,NAD83,1412.54,0.01,NGVD29,09020202,pk,NA,NA,0,NA,wat,NA,0,0,1930-02-24,1951-04-09,15
USGS,05055520,"BIG COULEE NR FORT TOTTEN, ND",ST,47.88249809,-98.967618,S,NAD83,1480,10,NGVD29,09020202,pk,NA,NA,0,NA,wat,NA,0,0,1966-03-13,1975-04-15,10
USGS,05056020,"MAUVAIS COULEE TRIBUTARY NEAR BISBEE, ND",ST,48.5166665,-99.3865277,S,NAD83,NA,NA,NA,09020201,pk,NA,NA,0,NA,wat,NA,0,0,NA,1973-01-01,19
USGS,05056060,"MAUVAIS COULEE TRIB NO. 3 NR CANDO, ND",ST,48.4575008,-99.2243037,R,NAD83,1453.73,0.04,NAVD88,09020201,pk,NA,NA,0,NA,wat,NA,0,0,NA,2022-04-28,53
USGS,05056080,"MAUVAIS COULEE TRIB NO. 4 NR BISBEE, ND",ST,48.48611,-99.4476386,S,NAD83,NA,NA,NA,09020201,pk,NA,NA,0,NA,wat,NA,0,0,1955-04-01,1973-03-15,19
USGS,05056100,"MAUVAIS COULEE NR CANDO, ND",ST,48.4480588,-99.1026354,F,NAD83,1446.24,0.04,NAVD88,09020201,pk,NA,NA,0,NA,wat,NA,0,0,1954-06-16,2023-04-23,68
USGS,05056225,"WEBSTER COULEE AT WEBSTER, ND",ST,48.28250308,-98.9190167,S,NAD83,NA,NA,NA,09020201,pk,NA,NA,0,NA,wat,NA,0,0,1980-04-02,1994-04-11,8
USGS,05056239,"STARKWEATHER COULEE NR WEBSTER, ND",ST,48.3205591,-98.9406851,R,NAD83,1449.15,0.04,NAVD88,09020201,pk,NA,NA,0,NA,wat,NA,0,0,1980-04-07,2023-04-22,44
USGS,05056244,"ST. JOE COULEE NR WEBSTER, ND",ST,48.3230585,-99.0056879,S,NAD83,1444,1,NGVD29,09020201,pk,NA,NA,0,NA,wat,NA,0,0,1987-04-08,1988-03-31,2
USGS,05056247,"CALIO COULEE NR STARKWEATHER, ND",ST,48.399448,-99.0465229,S,NAD83,1452,1,NGVD29,09020201,pk,NA,NA,0,NA,wat,NA,0,0,1986-03-25,1994-03-28,4
USGS,05056265,"BIG COULEE AT HWY 2 NEAR CHURCHS FERRY, ND",ST,48.26166538,-99.1876342,S,NAD83,1401.27,0.04,NAVD88,09020201,pk,NA,NA,0,NA,wat,NA,0,0,2011-06-29,2023-05-24,13
USGS,05056270,"BIG COULEE BL CHURCHS FERRY, ND",ST,48.2591651,-99.2004122,F,NAD83,NA,NA,NA,09020201,pk,NA,NA,0,NA,wat,NA,0,0,1998-04-19,2004-04-09,5
USGS,05056300,"LITTLE COULEE AT LEEDS, ND",ST,48.28749939,-99.4490241,S,NAD83,1489.92,0.01,NGVD29,09020201,pk,NA,NA,0,NA,wat,NA,0,0,1956-04-15,1973-03-08,17
USGS,05056340,"LITTLE COULEE NR LEEDS, ND",ST,48.2433322,-99.3729125,R,NAD83,1426.01,0.04,NAVD88,09020201,pk,NA,NA,0,NA,wat,NA,0,0,1998-03-30,2023-04-23,26
USGS,05056390,"LITTLE COULEE NR BRINSMADE, ND",ST,48.1874981,-99.2431904,S,NAD83,NA,NA,NA,09020201,pk,NA,NA,0,NA,wat,NA,0,0,1976-03-28,1997-04-26,20
USGS,05056400,"BIG COULEE NR CHURCHS FERRY, ND",ST,48.1777762,-99.2212455,S,NAD83,1432.65,0.01,NGVD29,09020201,pk,NA,NA,0,NA,wat,NA,0,0,1950-06-06,1997-05-04,48
USGS,05056403,"COMSTOCK COULEE NR MINNEWAUKAN, ND",ST,48.10916548,-99.2284677,S,NAD83,1435,5,NGVD29,09020201,pk,NA,NA,0,NA,wat,NA,0,0,1986-03-17,1994-03-23,4
USGS,05056410,"CHANNEL A NEAR PENN, ND",ST,48.1666675,-98.9801277,F,NAD83,NA,NA,NA,09020201,pk,NA,NA,0,NA,wat,NA,0,0,1984-06-24,2004-04-16,21
USGS,05116000,"SOURIS RIVER NR FOXHOLM, ND",ST,48.3722357,-101.5054414,F,NAD83,1562.04,0.09,NAVD88,09010008,pk,NA,NA,0,NA,wat,NA,0,0,1937-05-17,2023-04-23,87
USGS,05116100,"SOURIS RIVER TRIB NR BURLINGTON, ND",ST,48.3011223,-101.4207191,S,NAD83,1590,1,NGVD29,09010008,pk,NA,NA,0,NA,wat,NA,0,0,1959-01-01,2006-03-30,24
USGS,05116150,"DES LACS RIVER NEAR KENMARE, ND",ST,48.58967728,-101.9974985,S,NAD83,1877.24,0.01,NGVD29,09010002,pk,NA,NA,0,NA,wat,NA,0,0,1988-05-15,2023-04-12,10
USGS,05116200,"DES LACS RIVER TRIBUTARY NR DONNYBROOK, ND",ST,48.49307549,-101.855995,S,NAD83,NA,NA,NA,09010002,pk,NA,NA,0,NA,wat,NA,0,0,NA,NA,18
USGS,05116500,"DES LACS RIVER AT FOXHOLM, ND",ST,48.37056947,-101.5701633,F,NAD83,1634.06,0.09,NAVD88,09010002,pk,NA,NA,0,NA,wat,NA,0,0,1939-01-01,2023-04-12,79
USGS,05116550,"FULLER COULEE AT FOXHOLM, ND",ST,48.3625136,-101.5671079,S,NAD83,NA,NA,NA,09010002,pk,NA,NA,0,NA,wat,NA,0,0,1955-03-29,NA,19
USGS,05117200,"SOURIS RIVER TRIB NO. 2 NR BURLINGTON, ND",ST,48.2547319,-101.3804413,S,NAD83,NA,NA,NA,09010008,pk,NA,NA,0,NA,wat,NA,0,0,1960-03-26,NA,14
USGS,05117500,"SOURIS RIVER ABOVE MINOT, ND",ST,48.2458428,-101.3712745,F,NAD83,1546.88,0.04,NAVD88,09010008,pk,NA,NA,0,NA,wat,NA,0,0,1904-04-20,2023-04-13,120
USGS,05119410,"BONNES COULEE NEAR VELVA, ND",ST,48.058342,-100.9504287,S,NAD83,1509,4.3,NAVD88,09010008,pk,NA,NA,0,NA,wat,NA,0,0,1965-04-12,2023-05-13,43
USGS,05120000,"SOURIS RIVER NR VERENDRYE, ND",ST,48.15972928,-100.7295863,F,NAD83,1466.23,0.09,NAVD88,09010003,pk,NA,NA,0,NA,wat,NA,0,0,1937-05-23,2023-04-15,87
USGS,05120180,"WINTERING RIVER TRIBUTARY NR KONGSBERG, ND",ST,47.862504,-100.7595879,S,NAD83,1729,1,NGVD29,09010003,pk,NA,NA,0,NA,wat,NA,0,0,1998-07-05,2009-04-14,12
USGS,05120200,"WINTERING RIVER NR BERGEN, ND",ST,47.93056058,-100.6712546,S,NAD83,1587.91,0.01,NGVD29,09010003,pk,NA,NA,0,NA,wat,NA,0,0,1957-03-21,1978-03-22,22
USGS,05120500,"WINTERING RIVER NEAR KARLSRUHE, ND",ST,48.1382932,-100.5399409,F,NAD83,1501.4,0.09,NAVD88,09010003,pk,NA,NA,0,NA,wat,NA,0,0,1937-06-13,2023-04-14,87
USGS,05121000,SOURIS RIVER WEST OUTFALL AT EATON DAM NR TOWNER,ST,48.275,-100.4927778,S,NAD83,1460,4.3,NAVD88,09010003,pk,NA,NA,0,NA,wat,NA,0,0,2004-03-27,2013-01-01,10
USGS,05121001,SOURIS RIVER EAST OUTFALL AT EATON DAM NR TOWNER,ST,48.2758333,-100.4880556,S,NAD83,1456,4.3,NAVD88,09010003,pk,NA,NA,0,NA,wat,NA,0,0,2004-04-07,2013-01-01,10
USGS,05121500,"SOURIS RIVER NR TOWNER, ND",ST,48.3069448,-100.4609686,T,NAD83,1443.5,0.01,NGVD29,09010003,pk,NA,NA,0,NA,wat,NA,0,0,1933-04-10,1939-10-27,8
USGS,05122000,"SOURIS RIVER NR BANTRY, ND",ST,48.50555109,-100.4348534,F,NAD83,1428.95,0.11,NAVD88,09010003,pk,NA,NA,0,NA,wat,NA,0,0,1937-07-06,2023-04-26,87
USGS,05123400,"WILLOW CREEK NEAR WILLOW CITY, ND",ST,48.5877399,-100.4416083,F,NAD83,1431.83,0.11,NAVD88,09010004,pk,NA,NA,0,NA,wat,NA,0,0,1957-03-29,2023-04-17,67
USGS,05123510,"DEEP RIVER NEAR UPHAM, ND",ST,48.58412696,-100.8627348,F,NAD83,1427.26,0.11,NAVD88,09010005,pk,NA,NA,0,NA,wat,NA,0,0,NA,2023-04-19,61
USGS,05123520,"EGG CREEK NEAR GLENBURN, ND",ST,48.4875176,-101.4046052,S,NAD83,NA,NA,NA,09010005,pk,NA,NA,0,NA,wat,NA,0,0,1955-03-29,1973-06-03,19
USGS,05123540,"EGG CREEK NEAR RUTHVILLE, ND",ST,48.44029409,-101.299049,S,NAD83,NA,NA,NA,09010005,pk,NA,NA,0,NA,wat,NA,0,0,1955-03-30,1973-06-02,19
USGS,05123560,"EGG CREEK TRIBUTARY NEAR DEERING, ND",ST,48.3708482,-101.1532125,S,NAD83,NA,NA,NA,09010005,pk,NA,NA,0,NA,wat,NA,0,0,1955-03-30,NA,19
USGS,05123580,"EGG CREEK NEAR DEERING, ND",ST,48.3430699,-101.122656,S,NAD83,NA,NA,NA,09010005,pk,NA,NA,0,NA,wat,NA,0,0,1955-04-01,NA,19
USGS,05123600,"EGG CREEK NR GRANVILLE, ND",ST,48.35500886,-100.8223639,S,NAD83,1478.14,0.01,NGVD29,09010005,pk,NA,NA,0,NA,wat,NA,0,0,1957-01-01,1981-02-22,25
USGS,05123700,"CUT BANK CREEK AT N LAKE OUTLET NR GRANVILLE, ND",ST,48.3861174,-100.7670824,S,NAD83,1477.25,0.01,NGVD29,09010005,pk,NA,NA,0,NA,wat,NA,0,0,1957-01-01,1980-04-18,24
USGS,05123750,"CUT BANK CREEK AT UPHAM, ND",ST,48.57472866,-100.7445825,S,NAD83,1422,1,NGVD29,09010005,pk,NA,NA,0,NA,wat,NA,0,0,1975-05-08,2000-07-07,12
USGS,06006000,"Red Rock Cr ab Lakes, nr Lakeview, MT",ST,44.61579167,-111.6256694,1,NAD83,6673,20,NAVD88,10020001,pk,NA,NA,0,NA,wat,NA,0,0,1997-06-10,2023-06-14,27
USGS,06007000,Tom Creek near Lakeview MT,ST,44.588275,-111.6640917,1,NAD83,6740,10,NGVD29,10020001,pk,NA,NA,0,NA,wat,NA,0,0,1989-05-18,1989-05-18,1
USGS,06008000,Odell Cr ab Taft Ranch nr Lakeview MT,ST,44.57740556,-111.7798639,1,NAD83,6750,10,NGVD29,10020001,pk,NA,NA,0,NA,wat,NA,0,0,1994-05-08,1998-06-26,5
USGS,06010600,Red Rock River at Brundage Bridge nr Monida,ST,44.65758889,-111.9825639,1,NAD83,6605,1,NGVD29,10020001,pk,NA,NA,0,NA,wat,NA,0,0,1989-05-11,1989-05-11,1
USGS,06019000,Ruby River ab Warm Springs C nr Alder MT,ST,44.9943833,-111.9662472,1,NAD83,6200,100,NGVD29,10020003,pk,NA,NA,0,NA,wat,NA,0,0,1948-05-21,1953-06-13,6
USGS,06030200,Jefferson River trib near Whitehall MT,ST,45.8757,-111.9955889,1,NAD83,4340,10,NGVD29,10020005,pk,NA,NA,0,NA,wat,NA,0,0,1960-01-01,1975-07-31,16
USGS,06030300,Jefferson River trib no. 2 nr Whitehall MT,ST,45.8802972,-111.9742556,1,NAD83,4330,10,NGVD29,10020005,pk,NA,NA,0,NA,wat,NA,0,0,1958-06-24,2012-01-01,55
USGS,06034500,Jefferson River at Sappington MT,ST,45.8037111,-111.752261,1,NAD83,4170,10,NGVD29,10020005,pk,NA,NA,0,NA,wat,NA,0,0,1895-05-24,1975-06-21,42
USGS,06034700,"Sand Creek at Sappington, MT",ST,45.7913611,-111.7555,1,NAD83,4218,20,NAVD88,10020005,pk,NA,NA,0,NA,wat,NA,0,0,1960-04-09,2023-06-04,17
USGS,06034800,Jefferson River trib no. 3 nr Sappington MT,ST,45.83331389,-111.6986472,1,NAD83,4200,100,NGVD29,10020005,pk,NA,NA,0,NA,wat,NA,0,0,1960-02-01,1974-01-01,15
USGS,06035000,Willow Creek near Harrison MT,ST,45.7230583,-111.741025,1,NAD83,4750,1,NAVD88,10020005,pk,NA,NA,0,NA,wat,NA,0,0,1938-07-03,2023-06-04,85
USGS,06035500,Norwegian Creek near Harrison MT,ST,45.67754167,-111.7199778,1,NAD83,4750,10,NGVD29,10020005,pk,NA,NA,0,NA,wat,NA,0,0,1938-06-29,1951-04-01,11
USGS,06036500,Willow Creek near Willow Creek MT,ST,45.75035,-111.6582083,1,NAD83,4340,10,NGVD29,10020005,pk,NA,NA,0,NA,wat,NA,0,0,1920-06-17,1956-06-04,21
USGS,06036600,Jefferson River trib no. 4 nr Three Forks MT,ST,45.899625,-111.6018472,1,NAD83,4140,10,NGVD29,10020005,pk,NA,NA,0,NA,wat,NA,0,0,1960-01-01,1983-07-10,17
USGS,06036650,Jefferson River near Three Forks MT,ST,45.8971361,-111.5956722,1,NAD83,4076.76,0.01,NGVD29,10020005,pk,NA,NA,0,NA,wat,NA,0,0,1979-05-29,2023-05-29,45
USGS,06036700,Jefferson River trib no. 5 nr Three Forks MT,ST,45.90960556,-111.59845,1,NAD83,4120,10,NGVD29,10020005,pk,NA,NA,0,NA,wat,NA,0,0,1960-01-01,1983-01-01,18
USGS,06036805,"Firehole River at Old Faithful, YNP",ST,44.4593333,-110.8222722,1,NAD83,7352,5,NAVD88,10020007,pk,NA,NA,0,NA,wat,NA,0,0,2007-05-21,2023-06-18,17
USGS,06036905,Firehole River near West Yellowstone MT,ST,44.6201833,-110.8635028,1,NAD83,7050,10,NAVD88,10020007,pk,NA,NA,0,NA,wat,NA,0,0,1984-05-31,2023-05-23,34
USGS,06036940,"Tantalus Creek at Norris Junction, YNP",ST,44.732725,-110.7132528,1,NAD83,7460,5,NAVD88,10020007,pk,NA,NA,0,NA,wat,NA,0,0,2004-07-03,2023-07-20,20
USGS,06037000,Gibbon River near West Yellowstone MT,ST,44.64910556,-110.7847361,1,NAD83,6940,10,NGVD29,10020007,pk,NA,NA,0,NA,wat,NA,0,0,1984-05-15,1996-05-18,13
USGS,06037100,"Gibbon River at Madison Jct, YNP",ST,44.6408,-110.8610639,1,NAD83,6800,10,NAVD88,10020007,pk,NA,NA,0,NA,wat,NA,0,0,2001-05-16,2023-05-23,22
USGS,06037500,"Madison River near West Yellowstone, MT",ST,44.6570722,-111.0679639,1,NAD83,6650,1,NAVD88,10020007,pk,NA,NA,0,NA,wat,NA,0,0,1914-05-21,2023-05-23,97
USGS,06038500,Madison River bl Hebgen Lake nr Grayling MT,ST,44.86639167,-111.3387806,1,NAD83,6448.47,0.01,NGVD29,10020007,pk,NA,NA,0,NA,wat,NA,0,0,1940-07-25,2023-05-28,83
USGS,06038550,Cabin Creek near West Yellowstone MT,ST,44.87144167,-111.343461,1,NAD83,6476.23,0.01,NGVD29,10020007,pk,NA,NA,0,NA,wat,NA,0,0,1974-01-01,2023-05-23,50
USGS,06038800,Madison River at Kirby Ranch nr Cameron MT,ST,44.88865556,-111.580886,1,NAD83,5860,1,NAVD88,10020007,pk,NA,NA,0,NA,wat,NA,0,0,1959-10-23,2023-05-29,42
USGS,06039200,West Fork Madison River near Cameron MT,ST,44.88754167,-111.5828417,1,NAD83,5870,10,NGVD29,10020007,pk,NA,NA,0,NA,wat,NA,0,0,1966-05-29,1967-05-25,2
USGS,06040000,Madison River near Cameron MT,ST,45.2331333,-111.7516333,1,NAD83,5135,1,NAVD88,10020007,pk,NA,NA,0,NA,wat,NA,0,0,1952-06-07,2023-05-30,27
USGS,06040300,Jack Creek near Ennis MT,ST,45.35626667,-111.5816222,1,NAD83,5600,100,NGVD29,10020007,pk,NA,NA,0,NA,wat,NA,0,0,1974-06-14,1992-06-16,15
USGS,06040800,Madison River ab powerplant nr McAllister MT,ST,45.4865944,-111.6338583,1,NAD83,4690,5,NAVD88,10020007,pk,NA,NA,0,NA,wat,NA,0,0,2002-06-02,2022-06-13,21
USGS,06041000,Madison River bl Ennis Lake nr McAllister MT,ST,45.49023056,-111.6345056,1,NAD83,4689.03,0.01,NGVD29,10020007,pk,NA,NA,0,NA,wat,NA,0,0,1939-05-18,2023-05-28,85
USGS,06042000,Madison River bl Cherry Cr nr Norris MT,ST,45.6471694,-111.5242528,1,NAD83,4400,100,NGVD29,10020007,pk,NA,NA,0,NA,wat,NA,0,0,1898-06-18,1905-06-06,8
USGS,06042500,Madison River near Three Forks MT,ST,45.8235583,-111.4996556,1,NAD83,4160,10,NGVD29,10020007,pk,NA,NA,0,NA,wat,NA,0,0,1894-06-02,1950-06-17,16
USGS,06043000,Taylor Creek near Grayling MT,ST,45.0708972,-111.2051694,1,NAD83,6600,100,NGVD29,10020008,pk,NA,NA,0,NA,wat,NA,0,0,1947-06-20,1967-06-22,11
USGS,06043120,"Gallatin River above Deer Creek, near Big Sky, MT",ST,45.29727778,-111.2113917,1,NAD83,5875,20,NAVD88,10020008,pk,NA,NA,0,NA,wat,NA,0,0,2019-06-07,2023-05-23,5
USGS,06043200,"Storm Castle Creek near Gallatin Gateway, MT",ST,45.4414,-111.2066972,1,NAD83,5400,100,NGVD29,10020008,pk,NA,NA,0,NA,wat,NA,0,0,1959-06-07,1975-06-16,17
USGS,06043300,Logger Creek near Gallatin Gateway MT,ST,45.45395,-111.2449,1,NAD83,5340,10,NGVD29,10020008,pk,NA,NA,0,NA,wat,NA,0,0,1959-06-07,2023-05-23,65
USGS,06043500,"Gallatin River near Gallatin Gateway, MT",ST,45.4973,-111.2707083,1,NAD83,5167.67,0.01,NGVD29,10020008,pk,NA,NA,0,NA,wat,NA,0,0,1890-06-10,2023-05-23,95
USGS,06044000,Gallatin River near Salesville MT,ST,45.54052778,-111.2341667,1,NAD83,5050,10,NGVD29,10020008,pk,NA,NA,0,NA,wat,NA,0,0,1896-06-18,1923-06-09,15
USGS,06046500,Rocky Creek near Bozeman MT,ST,45.64362778,-110.9265583,1,NAD83,5076,20,NAVD88,10020008,pk,NA,NA,0,NA,wat,NA,0,0,1952-04-19,1991-05-14,35
USGS,06046520,Unnamed Creek near Bozeman MT,ST,45.66641389,-110.9816861,1,NAD83,4900,100,NGVD29,10020008,pk,NA,NA,0,NA,wat,NA,0,0,1998-04-02,2002-06-13,5
USGS,06046700,Pitcher Creek near Bozeman MT,ST,45.654875,-110.9426111,1,NAD83,5040,10,NGVD29,10020008,pk,NA,NA,0,NA,wat,NA,0,0,1960-05-13,1981-05-22,17
USGS,06047000,"Bear Canyon Creek near Bozeman, MT",ST,45.62406667,-110.9348667,1,NAD83,5183.4,0.1,NGVD29,10020008,pk,NA,NA,0,NA,wat,NA,0,0,1952-05-26,1981-05-22,19
USGS,06048000,East Gallatin River at Bozeman MT,ST,45.7005361,-111.0292667,1,NAD83,4701.6,0.1,NGVD29,10020008,pk,NA,NA,0,NA,wat,NA,0,0,1940-06-09,1981-05-22,23
USGS,06048500,Bridger Creek near Bozeman MT,ST,45.705175,-110.9620556,1,NAD83,4960,10,NGVD29,10020008,pk,NA,NA,0,NA,wat,NA,0,0,1946-04-27,1987-05-28,28
USGS,06048650,E Gallatin R ab Water Reclamation Fa nr Bozeman MT,ST,45.72566667,-111.0661944,1,NAD83,4625,5,NGVD29,10020008,pk,NA,NA,0,NA,wat,NA,0,0,2015-05-18,2023-05-05,9
USGS,06048700,East Gallatin R bl Bridger C nr Bozeman MT,ST,45.725425,-111.0685917,1,NAD83,4610,10,NAVD88,10020008,pk,NA,NA,0,NA,wat,NA,0,0,2002-05-22,2014-05-19,13
USGS,06050000,Hyalite C at Hyalite R S nr Bozeman MT,ST,45.56332778,-111.0718889,5,NAD83,5539.6,0.1,NAVD88,10020008,pk,NA,NA,0,NA,wat,NA,0,0,1898-06-14,2023-06-04,72
USGS,06052500,Gallatin River at Logan MT,ST,45.88535556,-111.438286,1,NAD83,4086.42,0.01,NGVD29,10020008,pk,NA,NA,0,NA,wat,NA,0,0,1895-06-24,2023-06-04,104
USGS,06053000,Sixteenmile Creek at Ringling MT,ST,46.27219167,-110.8053889,1,NAD83,5300,100,NGVD29,10030101,pk,NA,NA,0,NA,wat,NA,0,0,1951-04-05,1955-04-16,5
USGS,06053050,Lost Creek near Ringling MT,ST,46.260525,-110.7862111,1,NAD83,5340,10,NGVD29,10030101,pk,NA,NA,0,NA,wat,NA,0,0,1974-01-16,2023-04-10,50
USGS,06054500,Missouri River at Toston MT,ST,46.1465722,-111.4202778,1,NAD83,3905.68,0.01,NGVD29,10030101,pk,NA,NA,0,NA,wat,NA,0,0,1890-05-30,2023-06-04,91
USGS,06055500,Crow Creek near Radersburg MT,ST,46.26228889,-111.6871194,1,NAD83,4820,10,NGVD29,10030101,pk,NA,NA,0,NA,wat,NA,0,0,1901-05-03,1990-05-30,22
USGS,06056200,"Castle Creek Tributary near Ringling, MT",ST,46.35845,-111.0967806,1,NAD83,5679,20,NAVD88,10030101,pk,NA,NA,0,NA,wat,NA,0,0,1960-05-04,2023-05-01,19
USGS,06056300,Cabin Creek near Townsend MT,ST,46.3348583,-111.2199778,1,NAD83,4900,100,NGVD29,10030101,pk,NA,NA,0,NA,wat,NA,0,0,1960-06-04,2023-06-04,64
USGS,06056600,Deep Cr bl N F Deep C nr Townsend MT,ST,46.32465556,-111.2934806,1,NAD83,4510,10,NGVD29,10030101,pk,NA,NA,0,NA,wat,NA,0,0,1959-06-07,1990-05-30,19
USGS,06057000,Missouri River near Townsend MT,ST,46.33473889,-111.5313722,1,NAD83,3785,1,NGVD29,10030101,pk,NA,NA,0,NA,wat,NA,0,0,1892-06-22,1964-06-13,13
USGS,06058700,Mitchell Gulch near East Helena MT,ST,46.57126389,-111.8234556,1,NAD83,4060,10,NGVD29,10030101,pk,NA,NA,0,NA,wat,NA,0,0,NA,2003-03-13,45
USGS,06058900,Prickly Pear C bl Andrsn Gl nr Jefferson Cty MT,ST,46.36223889,-111.9971972,1,NAD83,4900,100,NGVD29,10030101,pk,NA,NA,0,NA,wat,NA,0,0,1989-05-10,1990-06-10,2
USGS,06061000,Lump Gulch C at Zastrow's Rch nr Clancy MT,ST,46.48211389,-111.9964944,1,NAD83,4220,10,NGVD29,10030101,pk,NA,NA,0,NA,wat,NA,0,0,1909-06-09,1981-05-22,6
USGS,06061500,Prickly Pear Creek near Clancy MT,ST,46.5190972,-111.946786,1,NAD83,4067.1,0.1,NGVD29,10030101,pk,NA,NA,0,NA,wat,NA,0,0,1911-06-08,2023-06-03,83
USGS,06061700,Jackson Creek near East Helena MT,ST,46.471775,-111.8531444,1,NAD83,4990,10,NGVD29,10030101,pk,NA,NA,0,NA,wat,NA,0,0,1961-05-01,1990-08-19,18
USGS,06061800,Crystal Creek near East Helena MT,ST,46.4831694,-111.8610278,1,NAD83,4860,10,NGVD29,10030101,pk,NA,NA,0,NA,wat,NA,0,0,1961-05-01,1990-05-07,18
USGS,06061900,Mcclellan Creek nr East Helena MT,ST,46.53306667,-111.8790944,1,NAD83,4200,100,NGVD29,10030101,pk,NA,NA,0,NA,wat,NA,0,0,NA,1990-05-29,19
USGS,06064150,Tenmile Cr ab Prickley Pear Cr nr Helena,ST,46.6607472,-111.9899444,1,NAD83,3690,10,NGVD29,10030101,pk,NA,NA,0,NA,wat,NA,0,0,1997-06-11,1998-06-20,2
USGS,06065500,Missouri River bl Hauser Dam near Helena MT,ST,46.76619167,-111.8887944,1,NAD83,3580,1,NAVD88,10030101,pk,NA,NA,0,NA,wat,NA,0,0,1923-05-28,2023-06-11,49
USGS,06071400,"Dog Creek near Craig, MT",ST,47.08651389,-111.9936472,1,NAD83,3643,20,NAVD88,10030102,pk,NA,NA,0,NA,wat,NA,0,0,1960-03-19,2022-01-01,17
USGS,06071600,Wegner Creek at Craig MT,ST,47.0762111,-111.9554556,1,NAD83,3450,10,NGVD29,10030102,pk,NA,NA,0,NA,wat,NA,0,0,1960-06-02,1991-04-23,32
USGS,06074000,Missouri River at Cascade MT,ST,47.2694861,-111.6952306,1,NAD83,3337.8,0.1,NGVD29,10030102,pk,NA,NA,0,NA,wat,NA,0,0,1903-06-09,2023-06-10,23
USGS,06074500,Smith River nr White Sulphur Springs MT,ST,46.67169167,-110.7233639,1,NAD83,5600,100,NGVD29,10030103,pk,NA,NA,0,NA,wat,NA,0,0,1923-06-21,1936-04-11,12
USGS,06075500,Smith R ab Fivemile C nr White Sul Spgs MT,ST,46.6137583,-110.7612806,1,NAD83,5400,100,NGVD29,10030103,pk,NA,NA,0,NA,wat,NA,0,0,1934-06-07,1943-06-03,10
USGS,06075600,Fivemile Cr nr White Sulphur Springs MT,ST,46.61277778,-110.75665,1,NAD83,5380,10,NGVD29,10030103,pk,NA,NA,0,NA,wat,NA,0,0,1960-05-01,1974-01-15,15
USGS,06076000,Newlan Cr nr White Sulphur Springs MT,ST,46.73159167,-110.8387472,1,NAD83,5590,10,NGVD29,10030103,pk,NA,NA,0,NA,wat,NA,0,0,1946-06-11,1973-06-12,22
USGS,06076500,Newlan C nr Damsite nr White Sulphur Springs MT,ST,46.63358056,-110.9578722,1,NAD83,5100,100,NGVD29,10030103,pk,NA,NA,0,NA,wat,NA,0,0,1951-05-14,1957-06-16,7
USGS,06076560,Smith River bl Newlan Cr nr White Sulphur Springs,ST,46.59105,-111.0576861,1,NAD83,4785,5,NGVD29,10030103,pk,NA,NA,0,NA,wat,NA,0,0,2005-06-07,2011-06-09,7
USGS,06076590,Camas C nr Mouth nr White Sulphur Springs MT,ST,46.6784861,-111.1939194,5,NAD83,4642,10,NAVD88,10030103,pk,NA,NA,0,NA,wat,NA,0,0,2022-06-21,2023-05-05,2
USGS,06076690,Smith River near Ft Logan MT,ST,46.7958,-111.1785556,1,NAD83,4400,1,NGVD29,10030103,pk,NA,NA,0,NA,wat,NA,0,0,1978-03-22,2023-04-12,33
USGS,06076700,Sheep Creek near Neihart MT,ST,46.79958056,-110.7036694,1,NAD83,6600,100,NGVD29,10030103,pk,NA,NA,0,NA,wat,NA,0,0,1960-05-12,1991-05-18,32
USGS,06076800,Nugget Creek near Neihart MT,ST,46.7749194,-110.7014722,1,NAD83,6400,100,NGVD29,10030103,pk,NA,NA,0,NA,wat,NA,0,0,1959-06-07,1973-05-30,15
USGS,06077000,Sheep Cr nr White Sulphur Springs MT,ST,46.76816389,-110.8099778,1,NAD83,5820,10,NGVD29,10030103,pk,NA,NA,0,NA,wat,NA,0,0,1942-05-26,1981-05-22,33
USGS,06077200,Smith River bl Eagle Cr nr Fort Logan MT,ST,46.82798056,-111.1922389,1,NAD83,4350,20,NAVD88,10030103,pk,NA,NA,0,NA,wat,NA,0,0,1997-06-12,2023-05-06,27
USGS,06077300,Trout Creek near Eden MT,ST,47.11085278,-111.3668333,1,NAD83,4515,1,NGVD29,10030103,pk,NA,NA,0,NA,wat,NA,0,0,1974-01-01,1984-05-28,11
USGS,06077500,Smith River near Eden MT,ST,47.18929167,-111.3862389,1,NAD83,3520,10,NAVD88,10030103,pk,NA,NA,0,NA,wat,NA,0,0,1951-05-25,2023-05-06,39
USGS,06077700,Smith River Tributary near Eden MT,ST,47.3064222,-111.42445,1,NAD83,3420,10,NGVD29,10030103,pk,NA,NA,0,NA,wat,NA,0,0,1960-03-17,1975-05-07,16
USGS,06077800,Goodman Coulee nr Eden MT,ST,47.32374167,-111.4272139,1,NAD83,4560,10,NGVD29,10030103,pk,NA,NA,0,NA,wat,NA,0,0,1959-04-22,1982-04-11,24
USGS,06078000,Smith River at Truly MT,ST,47.35693889,-111.4412583,1,NAD83,3330,10,NGVD29,10030103,pk,NA,NA,0,NA,wat,NA,0,0,1905-06-12,1953-06-04,8
USGS,06078200,Missouri River near Ulm MT,ST,47.43496667,-111.3884444,1,NAD83,3313.27,0.01,NGVD29,10030102,pk,NA,NA,0,NA,wat,NA,0,0,NA,2023-06-12,68
USGS,06078230,Sand Coulee Ck ab Cottonwood Cr at Centerville,ST,47.3891972,-111.1387972,1,NAD83,3470,10,NGVD29,10030102,pk,NA,NA,0,NA,wat,NA,0,0,1995-06-07,1996-03-10,2
USGS,06078250,Cottonwood Creek near Stockett MT,ST,47.36828056,-111.15905,1,NAD83,3530,10,NGVD29,10030102,pk,NA,NA,0,NA,wat,NA,0,0,1995-05-15,1996-03-10,2
USGS,06078260,Number Five Coulee bl Giffen Spring nr Stockett,ST,47.317175,-111.18805,1,NAD83,3830,10,NGVD29,10030102,pk,NA,NA,0,NA,wat,NA,0,0,1995-06-06,1996-03-10,2
USGS,06078270,Sand Coulee at Sand Coulee MT,ST,47.4050111,-111.1637083,1,NAD83,3430,10,NGVD29,10030102,pk,NA,NA,0,NA,wat,NA,0,0,1995-06-06,1996-06-16,2
USGS,06085510,"Crown Butte creek tributary nr Simms, MT",ST,47.4504694,-111.9229417,1,NAD83,3660,10,NGVD29,10030102,pk,NA,NA,0,NA,wat,NA,0,0,2004-08-24,2023-01-01,20
USGS,06085800,Sun River at Simms MT,ST,47.50162778,-111.9319139,1,NAD83,3551.08,0.17,NAVD88,10030104,pk,NA,NA,0,NA,wat,NA,0,0,1964-06-09,2023-06-10,42
USGS,06086000,Sun River at Fort Shaw MT,ST,47.5134444,-111.8154972,1,NAD83,3465,1,NGVD29,10030104,pk,NA,NA,0,NA,wat,NA,0,0,1913-05-29,1928-05-23,16
USGS,06087500,Sun River at Sun River MT,ST,47.53585556,-111.717636,1,NAD83,3400,100,NGVD29,10030104,pk,NA,NA,0,NA,wat,NA,0,0,1906-06-05,1912-05-22,7
USGS,06087900,Muddy Creek Tributary near Power MT,ST,47.7556861,-111.7295583,1,NAD83,3710,10,NGVD29,10030104,pk,NA,NA,0,NA,wat,NA,0,0,1963-07-10,1986-02-25,17
USGS,06088000,Muddy Creek near Power MT,ST,47.7127333,-111.7226889,1,NAD83,3640,10,NGVD29,10030104,pk,NA,NA,0,NA,wat,NA,0,0,1982-06-29,1983-07-10,2
USGS,06088100,Spring Coulee near Power MT,ST,47.662925,-111.7045306,1,NAD83,3590,10,NGVD29,10030104,pk,NA,NA,0,NA,wat,NA,0,0,1982-06-30,1982-06-30,1
USGS,06088200,Tank Coulee near Power MT,ST,47.6433,-111.6802778,1,NAD83,3510,10,NGVD29,10030104,pk,NA,NA,0,NA,wat,NA,0,0,1982-06-28,1982-06-28,1
USGS,06088300,Muddy Creek near Vaughn MT,ST,47.6250222,-111.6354056,1,NAD83,3441.79,0.01,NGVD29,10030104,pk,NA,NA,0,NA,wat,NA,0,0,1968-08-16,2007-06-25,32
USGS,06088500,Muddy Creek at Vaughn MT,ST,47.56126667,-111.5417694,1,NAD83,3330,10,NAVD88,10030104,pk,NA,NA,0,NA,wat,NA,0,0,1925-06-05,2023-05-30,88
USGS,06089000,Sun River near Vaughn MT,ST,47.52577778,-111.511036,1,NAD83,3340.02,0.01,NGVD29,10030104,pk,NA,NA,0,NA,wat,NA,0,0,1934-06-08,2023-06-10,90
USGS,06089300,Sun River Tributary near Great Falls MT,ST,47.52705556,-111.401925,1,NAD83,3330,10,NGVD29,10030104,pk,NA,NA,0,NA,wat,NA,0,0,1956-03-20,1980-06-25,21
USGS,06090300,Missouri River near Great Falls MT,ST,47.5844444,-111.0605806,1,NAD83,2807.21,0.01,NGVD29,10030102,pk,NA,NA,0,NA,wat,NA,0,0,1952-05-04,2023-06-11,72
USGS,06090500,Belt Creek near Monarch MT,ST,47.2085944,-110.9317472,1,NAD83,3980,10,NAVD88,10030105,pk,NA,NA,0,NA,wat,NA,0,0,1952-05-04,2023-05-06,42
USGS,06090550,Little Otter Creek near Raynesford MT,ST,47.25177778,-110.7315917,1,NAD83,4180,10,NGVD29,10030105,pk,NA,NA,0,NA,wat,NA,0,0,1974-01-01,2023-05-06,50
USGS,06090570,Big Otter Creek near Belt MT,ST,47.3454861,-110.88942780000001,1,NAD83,3600,100,NGVD29,10030105,pk,NA,NA,0,NA,wat,NA,0,0,1994-03-02,1998-07-05,5
USGS,06090590,Anaconda Drain at Belt MT,ST,47.38373056,-110.9284917,1,NAD83,3520,10,NGVD29,10030105,pk,NA,NA,0,NA,wat,NA,0,0,1995-04-17,1996-09-19,2
USGS,06090610,Belt Creek near Portage MT,ST,47.58736389,-111.0317389,1,NAD83,2840,10,NGVD29,10030105,pk,NA,NA,0,NA,wat,NA,0,0,1981-05-22,1983-07-10,3
USGS,06090650,Lake Creek near Power MT,ST,47.70790556,-111.40915,1,NAD83,3640,1,NAVD88,10030102,pk,NA,NA,0,NA,wat,NA,0,0,1990-08-20,2015-08-04,26
USGS,06090700,Highwood Creek near Highwood MT,ST,47.5166344,-110.7507772,U,NAD83,3650,10,NGVD29,10030102,pk,NA,NA,0,NA,wat,NA,0,0,1964-06-08,1964-06-08,1
USGS,06090720,Highwood Creek near Portage MT,ST,47.6424583,-110.9335778,1,NAD83,2940,10,NGVD29,10030102,pk,NA,NA,0,NA,wat,NA,0,0,1981-05-22,1983-07-10,3
