agency_cd,site_no,station_nm,site_tp_cd,dec_lat_va,dec_long_va,coord_acy_cd,dec_coord_datum_cd,alt_va,alt_acy_va,alt_datum_cd,huc_cd,data_type_cd,parm_cd,stat_cd,ts_id,loc_web_ds,medium_grp_cd,parm_grp_cd,srs_id,access_cd,begin_date,end_date,count_nu
USGS,09217900,"BLACKS FORK NEAR ROBERTSON, WY",ST,40.95902778,-110.5797222,S,NAD83,8811.3,10,NGVD29,14040107,pk,NA,NA,0,NA,wat,NA,0,0,1938-06-05,2023-06-08,53
USGS,09218500,"BLACKS FORK NEAR MILLBURNE, WY",ST,41.03161367,-110.5793324,S,NAD83,8512.27,0.01,NGVD29,14040107,pk,NA,NA,0,NA,wat,NA,0,0,1940-05-15,2023-06-08,70
USGS,09219000,"BLACKS FORK NEAR URIE, WY",ST,41.35078398,-110.33599,T,NAD83,6545,10,NGVD29,14040107,pk,NA,NA,0,NA,wat,NA,0,0,1914-05-23,1955-06-09,29
USGS,09219200,"Blacks Fork above Smiths Fork, near Lyman, WY",ST,41.39415,-110.2059583,5,NAD83,6433,5,NAVD88,14040107,pk,NA,NA,0,NA,wat,NA,0,0,2018-05-27,2023-06-05,6
USGS,09219500,"E Fk Smiths Fk at China Meadows, nr Robertson, WY",ST,40.9333333,-110.4002778,F,NAD83,9390,10,NGVD29,14040107,pk,NA,NA,0,NA,wat,NA,0,0,2009-06-26,2015-06-16,6
USGS,09220000,"EAST FORK OF SMITHS FORK NEAR ROBERTSON, WY",ST,41.0538611,-110.3986389,S,NAD83,8470,10,NGVD29,14040107,pk,NA,NA,0,NA,wat,NA,0,0,1940-05-13,2023-06-08,83
USGS,09220500,"WEST FORK OF SMITH FORK NEAR ROBERTSON, WY",ST,41.02216908,-110.4793287,S,NAD83,8617,1,NGVD29,14040107,pk,NA,NA,0,NA,wat,NA,0,0,1940-05-11,1981-05-31,42
USGS,09221500,"SMITH FORK AT MOUNTAINVIEW, WY",ST,41.26439465,-110.3454343,M,NAD83,6820,10,NGVD29,14040107,pk,NA,NA,0,NA,wat,NA,0,0,1942-05-24,1957-06-09,16
USGS,09221680,"MUD SPRING HOLLOW NEAR CHURCH BUTTE, NR LYMAN, WY",ST,41.38467496,-110.187374,S,NAD83,6800,10,NGVD29,14040107,pk,NA,NA,0,NA,wat,NA,0,0,1965-06-11,1984-06-03,20
USGS,09221700,"MUD SPRING HOLLOW NEAR LYMAN, WY",ST,41.3832861,-110.1840406,M,NAD83,6770,10,NGVD29,14040107,pk,NA,NA,0,NA,wat,NA,0,0,1959-09-26,NA,13
USGS,09222000,"BLACKS FORK NEAR LYMAN, WY",ST,41.4521755,-110.1729294,S,NAD83,6380,10,NGVD29,14040107,pk,NA,NA,0,NA,wat,NA,0,0,1938-05-17,1983-06-03,42
USGS,09222300,LITTLE MUDDY C NR GLENCOE WY,ST,41.5816153,-110.5623905,U,NAD83,NA,NA,NA,14040108,pk,NA,NA,0,NA,wat,NA,0,0,1979-04-08,1979-04-08,1
USGS,09222400,"MUDDY CREEK NEAR HAMPTON, WY",ST,41.5380078,-110.2293209,U,NAD83,6323,10,NAVD88,14040108,pk,NA,NA,0,NA,wat,NA,0,0,1979-05-30,2023-05-03,8
USGS,09223000,"HAMS FORK BELOW POLE CREEK, NEAR FRONTIER, WY",ST,42.11088889,-110.7094167,S,NAD83,7455,20,NGVD29,14040107,pk,NA,NA,0,NA,wat,NA,0,0,1953-06-14,2023-05-23,71
USGS,09223385,"Hams Fork below Viva Naughton Reservoir, WY",ST,41.96336667,-110.6601056,5,NAD83,7160,10,NGVD29,14040107,pk,NA,NA,0,NA,wat,NA,0,0,2008-05-23,2016-05-23,9
USGS,09223500,"HAMS FORK NEAR FRONTIER, WY",ST,41.85688979,-110.5637817,F,NAD83,6970,10,NGVD29,14040107,pk,NA,NA,0,NA,wat,NA,0,0,1946-04-20,1972-05-24,27
USGS,09224000,"HAMS FORK AT DIAMONDVILLE, WY",ST,41.7824473,-110.5348913,F,NAD83,6870,10,NGVD29,14040107,pk,NA,NA,0,NA,wat,NA,0,0,1918-05-09,1949-05-19,19
USGS,09224600,"BLACKS FORK TRIBUTARY NEAR GRANGER, WY",ST,41.53440149,-109.9370902,S,NAD83,6460,10,NGVD29,14040107,pk,NA,NA,0,NA,wat,NA,0,0,1959-09-26,1981-05-03,23
USGS,09224700,"BLACKS FORK NEAR LITTLE AMERICA, WY",ST,41.54607224,-109.6934746,S,NAD83,6127.66,0.1,NGVD29,14040107,pk,NA,NA,0,NA,wat,NA,0,0,1962-06-16,2023-05-22,62
USGS,09224800,"MEADOW SPRINGS WASH TRIB NEAR GREEN RIVER, WY",ST,41.5435711,-109.7606986,S,NAD83,6370,10,NGVD29,14040107,pk,NA,NA,0,NA,wat,NA,0,0,1962-03-27,1980-10-16,18
USGS,09224810,"BLACKS FORK TRIBUTARY NO 2 NEAR GREEN RIVER, WY",ST,41.4596849,-109.6229177,F,NAD83,6650,10,NGVD29,14040107,pk,NA,NA,0,NA,wat,NA,0,0,1965-06-10,1981-01-01,17
USGS,09224820,"BLACKS FORK TRIBUTARY NO 3 NEAR GREEN RIVER, WY",ST,41.4249626,-109.6159734,F,NAD83,6570,10,NGVD29,14040107,pk,NA,NA,0,NA,wat,NA,0,0,NA,1984-07-20,20
USGS,09224840,"BLACKS FORK TRIBUTARY NO 4 NEAR GREEN RIVER, WY",ST,41.41107387,-109.6020842,F,NAD83,6570,10,NGVD29,14040107,pk,NA,NA,0,NA,wat,NA,0,0,1965-01-01,1981-09-01,17
USGS,09224980,"SUMMERS DRY CREEK NEAR GREEN RIVER, WY",ST,41.37357307,-109.6451415,F,NAD83,6880,10,NGVD29,14040107,pk,NA,NA,0,NA,wat,NA,0,0,1965-06-10,1981-05-03,17
USGS,09225000,"BLACKS FORK NEAR GREEN RIVER, WY",ST,41.3791291,-109.6115293,S,NAD83,6017.26,0.01,NGVD29,14040107,pk,NA,NA,0,NA,wat,NA,0,0,1948-03-26,1962-03-30,15
USGS,09225200,"Nahguch Hollow near Burntfork, WY",ST,41.17051667,-109.6101425,S,NAD83,6610,10,NGVD29,14040106,pk,NA,NA,0,NA,wat,NA,0,0,1965-06-10,1984-07-21,20
USGS,09225300,"GREEN RIVER TRIBUTARY NO 2 NEAR BURNTFORK, WY",ST,41.06107118,-109.6187552,F,NAD83,6540,10,NGVD29,14040106,pk,NA,NA,0,NA,wat,NA,0,0,1959-07-15,1981-05-17,22
USGS,09225500,"GREEN RIVER NEAR LINWOOD, UTAH",ST,40.9666262,-109.5784759,F,NAD83,5844.64,20,NGVD29,14040106,pk,NA,NA,0,NA,wat,NA,0,0,1929-06-20,1962-03-28,34
USGS,09226000,"HENRYS FORK NEAR LONETREE, WY",ST,41.00633678,-110.2709881,S,NAD83,8340,10,NGVD29,14040106,pk,NA,NA,0,NA,wat,NA,0,0,1943-05-03,1972-05-31,30
USGS,09226500,"MIDDLE FORK BEAVER CREEK NEAR LONETREE, WYO.",ST,40.9443932,-110.1793209,F,NAD83,8450,20,NGVD29,14040106,pk,NA,NA,0,NA,wat,NA,0,0,1949-06-18,1970-05-27,22
USGS,09227500,"WEST FORK BEAVER CREEK NEAR LONETREE, WYOMING",ST,40.94717019,-110.2173767,F,NAD83,8700,20,NGVD29,14040106,pk,NA,NA,0,NA,wat,NA,0,0,1949-06-18,1962-06-21,14
USGS,09228000,"HENRYS FORK NEAR BURNTFORK, WY",ST,41.0399526,-110.0487635,T,NAD83,7130,10,NGVD29,14040106,pk,NA,NA,0,NA,wat,NA,0,0,1943-06-01,1954-07-20,12
USGS,09228500,"BURNT FORK NEAR BURNTFORK, WY",ST,40.9463402,-110.0662645,S,NAD83,8300,20,NGVD29,14040106,pk,NA,NA,0,NA,wat,NA,0,0,1944-06-26,1983-06-21,40
USGS,09229000,"BURNT FORK AT BURNTFORK, WY",ST,41.0258333,-110.0075,T,NAD83,7099.19,0.01,NGVD29,14040106,pk,NA,NA,0,NA,wat,NA,0,0,1930-08-10,1942-05-26,12
USGS,09229450,"HENRYS FORK TRIBUTARY NEAR MANILA, UT",ST,41.02051477,-109.6801475,S,NAD83,6600,10,NGVD29,14040106,pk,NA,NA,0,NA,wat,NA,0,0,1965-05-15,1974-04-20,10
USGS,09229500,"HENRYS FORK NEAR MANILA, UT",ST,41.00452778,-109.6675556,5,NAD83,6060,10,NAVD88,14040106,pk,NA,NA,0,NA,wat,NA,0,0,1929-06-17,2023-04-11,88
USGS,09230300,"BIRCH SPRING DRAW AT FGNRA BOUNDARY NR MANILA, UT",ST,40.99027778,-109.6545278,5,NAD83,6060,10,NGVD29,14040106,pk,NA,NA,0,NA,wat,NA,0,0,2007-05-22,2011-10-06,6
USGS,09230500,"GREEN RIVER AT FLAMING GORGE, NEAR LINWOOD, UT",ST,40.95134806,-109.6076439,F,NAD83,5840,20,NGVD29,14040106,pk,NA,NA,0,NA,wat,NA,0,0,1924-01-01,1938-01-01,15
USGS,09232000,"SHEEP CREEK NEAR MANILA, UTAH",ST,40.88606539,-109.9034853,F,NAD83,8680,20,NGVD29,14040106,pk,NA,NA,0,NA,wat,NA,0,0,1943-05-02,1965-06-10,20
USGS,09232500,"SHEEP CREEK AT MOUTH NEAR MANILA, UTAH",ST,40.9332919,-109.6562573,F,NAD83,5870.87,20,NGVD29,14040106,pk,NA,NA,0,NA,wat,NA,0,0,1947-05-07,1961-05-30,15
USGS,09233000,"CARTER CREEK NEAR MANILA, UTAH",ST,40.83884416,-109.8312619,F,NAD83,8600,20,NGVD29,14040106,pk,NA,NA,0,NA,wat,NA,0,0,1949-06-19,1954-05-22,6
USGS,09234000,"CARTER CREEK AT MOUTH NEAR MANILA, UTAH",ST,40.8930143,-109.5923652,F,NAD83,5880,20,NGVD29,14040106,pk,NA,NA,0,NA,wat,NA,0,0,1947-05-09,1955-06-10,9
USGS,09234500,"GREEN RIVER NEAR GREENDALE, UT",ST,40.90829296,-109.422914,S,NAD83,5594.21,0.12,NAVD88,14040106,pk,NA,NA,0,NA,wat,NA,0,0,1951-06-03,2023-06-08,73
USGS,09234700,"RED CREEK NEAR DUTCH JOHN, UTAH",ST,40.9696816,-109.237352,F,NAD83,6180,20,NGVD29,14040106,pk,NA,NA,0,NA,wat,NA,0,0,1971-08-30,1976-08-04,6
USGS,09235100,"CROUSE CREEK NEAR VERNAL, UT",ST,40.7952383,-109.0912348,F,NAD83,6520,40,NGVD29,14040106,pk,NA,NA,0,NA,wat,NA,0,0,1987-04-08,1990-03-10,4
USGS,09235300,VERMILLION CREEK NEAR HIAWATHA COLO,ST,41.0149619,-108.644831,U,NAD83,NA,NA,NA,14040109,pk,NA,NA,0,NA,wat,NA,0,0,1979-08-20,1981-07-03,2
USGS,09235450,"VERMILLION CREEK AT INK SPRINGS RANCH, CO.",ST,40.76190829,-108.7264995,F,NAD83,5725,15,NGVD29,14040109,pk,NA,NA,0,NA,wat,NA,0,0,1977-07-24,1981-07-17,5
USGS,09235490,"VERMILLION CR. BLW. DOUGLAS DRAW NR. LODORE, CO",ST,40.72218614,-108.7578892,F,NAD83,5610,10,NGVD29,14040109,pk,NA,NA,0,NA,wat,NA,0,0,1995-06-10,1995-06-10,1
USGS,09235600,"POT CREEK ABOVE DIVERSIONS, NEAR VERNAL, UTAH",ST,40.768015,-109.3190219,S,NAD83,7550,20,NGVD29,14040106,pk,NA,NA,0,NA,wat,NA,0,0,1958-04-20,1993-05-20,36
USGS,09235800,"POT CREEK NEAR VERNAL, UTAH",ST,40.67357295,-109.0515105,F,NAD83,6900,100,NGVD29,14040106,pk,NA,NA,0,NA,wat,NA,0,0,1958-03-22,1982-04-26,25
USGS,09236000,"BEAR RIVER NEAR TOPONAS, CO",ST,40.04387328,-107.0722729,F,NAD83,9700,15,NGVD29,14050001,pk,NA,NA,0,NA,wat,NA,0,0,1953-06-18,1986-06-08,33
USGS,09237450,"YAMPA RIVER ABOVE STAGECOACH RESERVOIR, CO",ST,40.2642611,-106.8917667,S,NAD83,7235,10,NGVD29,14050001,pk,NA,NA,0,NA,wat,NA,0,0,1989-04-08,2023-05-11,35
USGS,09237500,"YAMPA RIVER BELOW STAGECOACH RESERVOIR, CO",ST,40.28654444,-106.8290556,T,NAD83,7068,4.3,NAVD88,14050001,pk,NA,NA,0,NA,wat,NA,0,0,1943-06-02,2023-05-13,57
USGS,09237800,"SERVICE CREEK NEAR OAK CREEK, CO.",ST,40.29581486,-106.8014349,F,NAD83,7000,15,NGVD29,14050001,pk,NA,NA,0,NA,wat,NA,0,0,1966-05-09,1973-05-20,8
USGS,09238000,"OAK CREEK NEAR OAK CREEK, CO.",ST,40.24386976,-107.0153283,F,NAD83,7850,15,NGVD29,14050001,pk,NA,NA,0,NA,wat,NA,0,0,1953-05-28,1957-05-09,5
USGS,09238300,"NORTH FORK WALTON CREEK NR RABBIT EARS PASS, CO.",ST,40.3955363,-106.649764,F,NAD83,9550,15,NGVD29,14050001,pk,NA,NA,0,NA,wat,NA,0,0,1973-06-10,1975-06-15,3
USGS,09238350,"FISHHOOK CREEK NEAR RABBIT EARS PASS, CO.",ST,40.42942425,-106.6767099,F,NAD83,9530,15,NGVD29,14050001,pk,NA,NA,0,NA,wat,NA,0,0,1973-06-25,1975-07-01,3
USGS,09238500,"WALTON CREEK NEAR STEAMBOAT SPRINGS, CO.",ST,40.4080346,-106.7869917,F,NAD83,7050,15,NGVD29,14050001,pk,NA,NA,0,NA,wat,NA,0,0,1921-06-15,1987-06-05,20
USGS,09238700,"FISH CR TRIB AB LONG LK, NR BUFFALO PASS, CO.",ST,40.47331224,-106.68004380000001,F,NAD83,9885,15,NGVD29,14050001,pk,NA,NA,0,NA,wat,NA,0,0,1985-06-15,1986-06-17,2
USGS,09238705,"LONG LAKE INLET NEAR BUFFALO PASS, CO.",ST,40.47359,-106.68004380000001,F,NAD83,9875,15,NGVD29,14050001,pk,NA,NA,0,NA,wat,NA,0,0,1987-05-11,1995-07-10,9
USGS,09238710,"FISH C TRIB BL LONG LK, NR BUFFLAO PASS, CO.",ST,40.4766454,-106.6875442,F,NAD83,9860,15,NGVD29,14050001,pk,NA,NA,0,NA,wat,NA,0,0,1985-06-08,1995-07-10,11
USGS,09238750,"MIDDLE FORK FISH CREEK NEAR BUFFALO PASS, CO",ST,40.499,-106.6926389,S,NAD83,9955,15,NGVD29,14050001,pk,NA,NA,0,NA,wat,NA,0,0,1985-06-09,1995-07-13,11
USGS,09238770,"GRANITE C NR BUFFALO PASS, CO.",ST,40.49303389,-106.6925446,F,NAD83,9875,15,NGVD29,14050001,pk,NA,NA,0,NA,wat,NA,0,0,1985-06-14,1995-07-10,11
USGS,09238800,"MID FK FISH CR TRIBUTARY BLW FISH CR RESERVOIR, CO",ST,40.49720037,-106.6989339,F,NAD83,9855,15,NGVD29,14050001,pk,NA,NA,0,NA,wat,NA,0,0,1985-06-07,1994-06-01,10
USGS,09238900,"FISH CR AT UPPER STA NR STEAMBOAT SPRINGS, CO",ST,40.4749775,-106.7869926,F,NAD83,7150,15,NGVD29,14050001,pk,NA,NA,0,NA,wat,NA,0,0,1967-05-25,2023-06-09,48
USGS,09239400,"SPRING CREEK NEAR STEAMBOAT SPRINGS, CO.",ST,40.49331029,-106.8053265,F,NAD83,6990,15,NGVD29,14050001,pk,NA,NA,0,NA,wat,NA,0,0,1966-05-09,1972-06-08,7
USGS,09239500,"YAMPA RIVER AT STEAMBOAT SPRINGS, CO",ST,40.4829861,-106.8324306,S,NAD83,6695.47,2,NGVD29,14050001,pk,NA,NA,0,NA,wat,NA,0,0,1904-05-25,2023-05-26,117
USGS,09240020,"YAMPA RIVER BELOW SODA CREEK AT STEAMBOAT SPGS, CO",ST,40.4892222,-106.8415278,S,NAD83,6690,20,NGVD29,14050001,pk,NA,NA,0,NA,wat,NA,0,0,2009-05-21,2023-05-27,15
USGS,09240500,"ELK RIVER AT HINMAN PARK, CO.",ST,40.75552836,-106.8100459,F,NAD83,7750,15,NGVD29,14050001,pk,NA,NA,0,NA,wat,NA,0,0,1913-05-24,1918-06-12,6
USGS,09240800,"SOUTH FORK ELK RIVER NEAR CLARK, CO.",ST,40.74525078,-106.8072682,F,NAD83,7980,15,NGVD29,14050001,pk,NA,NA,0,NA,wat,NA,0,0,1967-06-23,1973-06-26,7
USGS,09240900,"ELK RIVER ABOVE CLARK, CO",ST,40.743306,-106.8553254,S,NAD83,7520,10,NGVD29,14050001,pk,NA,NA,0,NA,wat,NA,0,0,1988-05-18,2003-06-01,12
USGS,09241000,"ELK RIVER AT CLARK, CO.",ST,40.7174726,-106.9158832,S,NAD83,7267.75,1,NGVD29,14050001,pk,NA,NA,0,NA,wat,NA,0,0,1911-06-16,2003-06-01,78
USGS,09242500,"ELK RIVER NEAR MILNER, CO.",ST,40.5146975,-106.9539407,F,NAD83,6590,15,NGVD29,14050001,pk,NA,NA,0,NA,wat,NA,0,0,1904-05-24,2023-05-16,55
USGS,09243000,"TROUT CREEK NEAR PHIPPSBURG, CO.",ST,40.15109279,-107.1317192,F,NAD83,9680,15,NGVD29,14050001,pk,NA,NA,0,NA,wat,NA,0,0,1954-05-21,1958-05-28,5
USGS,09243700,"MIDDLE CREEK NEAR OAK CREEK, CO",ST,40.38553335,-106.993107,F,NAD83,6720,15,NGVD29,14050001,pk,NA,NA,0,NA,wat,NA,0,0,1976-05-09,2001-05-02,26
USGS,09243800,"FOIDEL CREEK NEAR OAK CREEK, CO",ST,40.34581144,-107.085053,F,NAD83,6880,15,NGVD29,14050001,pk,NA,NA,0,NA,wat,NA,0,0,1976-03-30,2001-04-02,24
USGS,09243900,"FOIDEL CREEK AT MOUTH NEAR OAK CREEK, CO",ST,40.39025545,-106.9947738,F,NAD83,6730,15,NGVD29,14050001,pk,NA,NA,0,NA,wat,NA,0,0,1976-04-01,2001-04-03,25
USGS,09244100,"FISH CREEK NEAR MILNER, CO.",ST,40.33414469,-107.1392207,F,NAD83,6911.53,15,NGVD29,14050001,pk,NA,NA,0,NA,wat,NA,0,0,1956-05-06,1973-05-20,18
USGS,09244300,"GRASSY CREEK NEAR MOUNT HARRIS, CO.",ST,40.4469199,-107.1456109,F,NAD83,6580,15,NGVD29,14050001,pk,NA,NA,0,NA,wat,NA,0,0,1959-04-04,1966-03-16,8
USGS,09244400,"YAMPA RIVER NEAR HAYDEN, CO.",ST,40.4891411,-107.1597784,F,NAD83,6380,15,NGVD29,14050001,pk,NA,NA,0,NA,wat,NA,0,0,1966-05-09,1972-06-09,7
USGS,09244410,"YAMPA RIVER BELOW DIVERSION, NEAR HAYDEN, CO.",ST,40.48830779,-107.1597784,F,NAD83,6380,15,NGVD29,14050001,pk,NA,NA,0,NA,wat,NA,0,0,1966-05-09,1986-06-07,21
USGS,09244415,"SAGE CREEK ABOVE SAGE CREEK RES, NR HAYDEN, CO.",ST,40.3835877,-107.193389,F,NAD83,7220,15,NGVD29,14050001,pk,NA,NA,0,NA,wat,NA,0,0,1982-05-04,1983-04-24,2
USGS,09244460,"WATERING TROUGH GULCH NEAR HAYDEN, CO.",ST,40.38247595,-107.2808909,F,NAD83,NA,NA,NA,14050001,pk,NA,NA,0,NA,wat,NA,0,0,1980-04-29,1980-10-14,2
USGS,09244464,"HUBBERSON GULCH NEAR HAYDEN, CO.",ST,40.39108697,-107.2714464,F,NAD83,NA,NA,NA,14050001,pk,NA,NA,0,NA,wat,NA,0,0,1980-04-20,1981-08-31,2
USGS,09244470,"STOKES GULCH NEAR HAYDEN, CO.",ST,40.4683077,-107.2470023,F,NAD83,6375,15,NGVD29,14050001,pk,NA,NA,0,NA,wat,NA,0,0,1976-01-01,1981-05-04,6
USGS,09244490,"YAMPA RIVER ABOVE ELKHEAD CREEK NEAR HAYDEN, CO",ST,40.51793056,-107.3989444,5,NAD83,6240,20,NGVD29,14050001,pk,NA,NA,0,NA,wat,NA,0,0,2004-05-11,2023-05-16,20
USGS,09244500,"ELKHEAD CREEK NEAR CLARK, CO.",ST,40.7321936,-107.1695009,F,NAD83,7800,15,NGVD29,14050001,pk,NA,NA,0,NA,wat,NA,0,0,1944-05-22,1973-05-15,16
USGS,09245000,"ELKHEAD CREEK NEAR ELKHEAD, CO.",ST,40.6696938,-107.2850592,F,NAD83,6845,15,NGVD29,14050001,pk,NA,NA,0,NA,wat,NA,0,0,1953-05-20,1996-05-08,44
USGS,09245500,"NORTH FORK ELKHEAD CREEK NEAR ELKHEAD, CO.",ST,40.680527,-107.2872814,F,NAD83,7005,15,NGVD29,14050001,pk,NA,NA,0,NA,wat,NA,0,0,1959-05-13,1973-05-19,15
USGS,09246200,"ELKHEAD CREEK ABOVE LONG GULCH, NEAR HAYDEN, CO",ST,40.59163879,-107.3208933,S,NAD83,6405,5,NGVD29,14050001,pk,NA,NA,0,NA,wat,NA,0,0,1996-05-09,2023-05-04,28
USGS,09246400,"ELKHEAD CREEK BELOW MAYNARD GULCH, NEAR CRAIG, CO",ST,40.5447222,-107.3980556,S,NAD83,6250,15,NGVD29,14050001,pk,NA,NA,0,NA,wat,NA,0,0,1996-05-09,2008-05-20,13
USGS,09246500,"ELKHEAD CREEK NEAR CRAIG, CO",ST,40.5310829,-107.4361735,S,NAD83,6230,10,NGVD29,14050001,pk,NA,NA,0,NA,wat,NA,0,0,1906-05-30,2023-05-14,24
USGS,09246900,"FORTIFICATION CREEK NEAR, CRAIG, CO.",ST,40.75635768,-107.5464553,F,NAD83,6540,15,NGVD29,14050001,pk,NA,NA,0,NA,wat,NA,0,0,1956-03-25,1960-03-27,5
USGS,09246920,"FORTIFICATION CREEK NEAR FORTIFICATION, CO",ST,40.74385785,-107.5408996,F,NAD83,6520,15,NGVD29,14050001,pk,NA,NA,0,NA,wat,NA,0,0,1985-03-25,2005-06-05,10
USGS,09247000,"FORTIFICATION CREEK AT CRAIG, CO.",ST,40.51413796,-107.5414539,F,NAD83,6178.24,15,NGVD29,14050001,pk,NA,NA,0,NA,wat,NA,0,0,1910-03-23,1947-03-23,13
USGS,09247500,"YAMPA RIVER AT CRAIG, CO.",ST,40.4958048,-107.5533986,F,NAD83,6150,15,NGVD29,14050001,pk,NA,NA,0,NA,wat,NA,0,0,1902-05-17,1916-05-10,10
USGS,09247600,"YAMPA RIVER BELOW CRAIG, CO.",ST,40.48080479,-107.6142338,S,NAD83,6100,10,NGVD29,14050001,pk,NA,NA,0,NA,wat,NA,0,0,1985-05-06,2023-05-17,39
USGS,09248600,"EAST FORK OF WILLIAMS FORK AB WILLOW CREEK, CO.",ST,40.2610895,-107.2950565,F,NAD83,7100,15,NGVD29,14050001,pk,NA,NA,0,NA,wat,NA,0,0,1957-06-25,1972-06-08,16
USGS,09249000,"EAST FORK OF WILLIAMS FORK NEAR PAGODA, CO.",ST,40.312477,-107.3200577,F,NAD83,6830,15,NGVD29,14050001,pk,NA,NA,0,NA,wat,NA,0,0,1954-05-21,1971-05-16,18
USGS,09249200,"SOUTH FORK OF WILLIAMS FORK NEAR PAGODA, CO.",ST,40.21219945,-107.4428375,F,NAD83,7235,15,NGVD29,14050001,pk,NA,NA,0,NA,wat,NA,0,0,1966-05-09,1979-05-18,14
USGS,09249500,"WILLIAMS FORK AT HAMILTON, CO.",ST,40.36997324,-107.6092326,F,NAD83,6230,15,NGVD29,14050001,pk,NA,NA,0,NA,wat,NA,0,0,1904-05-19,1927-05-18,21
USGS,09249750,"WILLIAMS FORK AT MOUTH, NEAR HAMILTON, CO.",ST,40.43719419,-107.6478456,S,NAD83,6170,10,NGVD29,14050001,pk,NA,NA,0,NA,wat,NA,0,0,1984-05-16,2001-05-16,18
USGS,09250000,"MILK CREEK NEAR THORNBURGH, CO.",ST,40.19358547,-107.7322907,F,NAD83,6599.32,15,NGVD29,14050002,pk,NA,NA,0,NA,wat,NA,0,0,1953-05-29,1986-05-04,34
USGS,09250400,"GOOD SPRING CREEK AT AXIAL, CO.",ST,40.29025077,-107.7900712,F,NAD83,6390,15,NGVD29,14050002,pk,NA,NA,0,NA,wat,NA,0,0,1975-07-04,1977-10-07,4
USGS,09250507,"WILSON CREEK ABOVE TAYLOR CREEK NEAR AXIAL, CO.",ST,40.3146948,-107.8000718,F,NAD83,6315,15,NGVD29,14050002,pk,NA,NA,0,NA,wat,NA,0,0,1981-05-03,1992-03-16,12
USGS,09250510,"TAYLOR CREEK AT MOUTH NEAR AXIAL, CO.",ST,40.3133059,-107.799794,F,NAD83,6300,15,NGVD29,14050002,pk,NA,NA,0,NA,wat,NA,0,0,1976-02-09,1992-02-28,17
USGS,09250600,"WILSON CREEK NEAR AXIAL, CO.",ST,40.31552815,-107.7978495,F,NAD83,6300,15,NGVD29,14050002,pk,NA,NA,0,NA,wat,NA,0,0,1975-05-29,1980-02-18,6
USGS,09250610,"JUBB CREEK NEAR AXIAL, CO.",ST,40.3124724,-107.8222948,F,NAD83,6400,15,NGVD29,14050002,pk,NA,NA,0,NA,wat,NA,0,0,1976-02-09,1980-02-19,4
USGS,09250700,"MORGAN GULCH NEAR AXIAL, CO.",ST,40.33580486,-107.8856307,F,NAD83,6330,15,NGVD29,14050002,pk,NA,NA,0,NA,wat,NA,0,0,1980-10-14,1980-10-14,1
USGS,09250900,"LAY CREEK TRIBUTARY NEAR LAY, CO.",ST,40.5252471,-107.9250779,F,NAD83,6095,15,NGVD29,14050002,pk,NA,NA,0,NA,wat,NA,0,0,1977-01-01,1980-08-23,4
USGS,09251000,"YAMPA RIVER NEAR MAYBELL, CO",ST,40.50274666,-108.0334152,F,NAD83,5900.23,15,NGVD29,14050002,pk,NA,NA,0,NA,wat,NA,0,0,1904-05-28,2023-05-17,110
USGS,09251100,"YAMPA RIVER ABV. LITTLE SNAKE R. NR. MAYBELL, CO",ST,40.46080078,-108.4256528,S,NAD83,5640,20,NGVD29,14050002,pk,NA,NA,0,NA,wat,NA,0,0,1997-06-05,2003-06-03,7
USGS,09251500,"MF LITTLE SNAKE RIVER NEAR BATTLE CREEK, CO.",ST,40.9905222,-107.0442186,F,NAD83,7000,15,NGVD29,14050003,pk,NA,NA,0,NA,wat,NA,0,0,1912-05-25,1922-05-29,11
USGS,09251800,"NORTH FORK LITTLE SNAKE RIVER NEAR ENCAMPMENT, WY",ST,41.0425,-106.9572222,S,NAD83,8250,20,NGVD29,14050003,pk,NA,NA,0,NA,wat,NA,0,0,1956-05-24,1965-06-13,10
USGS,09251900,NF L SNAKE R NR SLATER COLO,ST,41.01524406,-107.022829,U,NAD83,7350,10,NGVD29,14050003,pk,NA,NA,0,NA,wat,NA,0,0,1956-05-24,1963-05-24,8
USGS,09252500,"SF LITTLE SNAKE RIVER NEAR BATTLE CREEK, CO.",ST,40.97635579,-107.05033,F,NAD83,7060,15,NGVD29,14050003,pk,NA,NA,0,NA,wat,NA,0,0,1912-05-21,1920-05-09,9
USGS,09253000,"LITTLE SNAKE RIVER NEAR SLATER, CO",ST,40.99941048,-107.143388,F,NAD83,6830,15,NGVD29,14050003,pk,NA,NA,0,NA,wat,NA,0,0,1943-06-01,2023-05-16,77
USGS,09253400,"BATTLE CREEK NEAR ENCAMPMENT, WY",ST,41.1322222,-107.0691667,F,NAD83,8375,20,NGVD29,14050003,pk,NA,NA,0,NA,wat,NA,0,0,1956-05-24,1988-06-07,12
USGS,09253500,"BATTLE CREEK NEAR SLATER, CO.",ST,41.0032989,-107.2383908,F,NAD83,6696.1,15,NGVD29,14050003,pk,NA,NA,0,NA,wat,NA,0,0,1943-06-01,1951-05-28,9
USGS,09254500,"SLATER FORK AT BAXTER RANCH, NEAR SLATER, CO.",ST,40.88941209,-107.3306157,F,NAD83,7070,15,NGVD29,14050003,pk,NA,NA,0,NA,wat,NA,0,0,1912-05-18,1922-05-25,10
USGS,09255000,"SLATER FORK NEAR SLATER, CO",ST,40.9824657,-107.3828391,S,NAD83,6600,10,NGVD29,14050003,pk,NA,NA,0,NA,wat,NA,0,0,1911-05-09,2023-05-12,94
USGS,09255400,"EAST FORK SAVERY CREEK NEAR ENCAMPMENT, WY",ST,41.2721841,-107.1589432,T,NAD83,8200,10,NGVD29,14050003,pk,NA,NA,0,NA,wat,NA,0,0,1956-05-23,1988-05-18,7
USGS,09255500,"SAVERY CREEK AT UPPER STATION, NEAR SAVERY, WY",ST,41.21801805,-107.3722831,S,NAD83,7000,10,NGVD29,14050003,pk,NA,NA,0,NA,wat,NA,0,0,1941-05-05,1972-05-06,23
USGS,09255900,"BIG SANDSTONE CREEK NEAR SAVERY, WY",ST,41.19996287,-107.17561069999999,T,NAD83,8250,10,NGVD29,14050003,pk,NA,NA,0,NA,wat,NA,0,0,1956-06-02,1988-06-06,7
USGS,09256000,"SAVERY CREEK NEAR SAVERY, WY",ST,41.09777778,-107.3819444,S,NAD83,6680,20,NGVD29,14050003,pk,NA,NA,0,NA,wat,NA,0,0,1942-04-12,1992-05-27,38
USGS,09257000,"LITTLE SNAKE RIVER NEAR DIXON, WY",ST,41.02852778,-107.5488611,5,NAD83,6340,5,NAVD88,14050003,pk,NA,NA,0,NA,wat,NA,0,0,1911-05-09,2021-05-23,80
USGS,09257500,"WILLOW CREEK NEAR BAGGS, WY.",ST,40.87663397,-107.4645082,F,NAD83,6250,15,NGVD29,14050003,pk,NA,NA,0,NA,wat,NA,0,0,1914-06-05,1923-06-13,10
USGS,09258000,"WILLOW CREEK NEAR DIXON, WY",ST,40.91552206,-107.521732,S,NAD83,6700,10,NGVD29,14050003,pk,NA,NA,0,NA,wat,NA,0,0,1954-07-25,1993-05-07,40
USGS,09258050,"Muddy Creek above Olson Draw, near Dad, WY",ST,41.4783333,-107.6025,R,NAD83,6835,10,NGVD29,14050004,pk,NA,NA,0,NA,wat,NA,0,0,2010-08-02,2023-05-15,13
USGS,09258200,"DRY COW CREEK NEAR BAGGS, WY",ST,41.33996098,-107.671181,S,NAD83,6530,10,NGVD29,14050004,pk,NA,NA,0,NA,wat,NA,0,0,1970-04-11,1981-07-12,12
USGS,09258900,"MUDDY CREEK ABOVE BAGGS, WY",ST,41.13190766,-107.646458,F,NAD83,6320,10,NGVD29,14050004,pk,NA,NA,0,NA,wat,NA,0,0,1958-08-19,1971-03-23,14
USGS,09258980,"MUDDY CREEK BELOW YOUNG DRAW, NEAR BAGGS, WY",ST,41.06815856,-107.6315964,5,NAD83,6270,10,NGVD29,14050004,pk,NA,NA,0,NA,wat,NA,0,0,2004-07-24,2023-04-14,20
USGS,09259000,"MUDDY CREEK NEAR BAGGS, WY",ST,41.0469088,-107.6509026,U,NAD83,6250,10,NGVD29,14050004,pk,NA,NA,0,NA,wat,NA,0,0,1988-03-22,1991-06-03,4
USGS,09259500,"FOURMILE CREEK NEAR BAGGS, WY.",ST,40.8405232,-107.5150652,F,NAD83,7200,15,NGVD29,14050003,pk,NA,NA,0,NA,wat,NA,0,0,1912-05-20,1922-05-30,11
USGS,09259700,"Little Snake River bl Dry Gulch, nr Baggs, WY",ST,41.0030203,-107.9203562,F,NAD83,6050,10,NGVD29,14050003,pk,NA,NA,0,NA,wat,NA,0,0,1962-03-28,1968-06-01,7
USGS,09259750,"LITTLE SNAKE RIVER TRIB NEAR GREAT DIVIDE, CO.",ST,40.8860769,-108.0970303,F,NAD83,NA,NA,NA,14050003,pk,NA,NA,0,NA,wat,NA,0,0,1974-01-01,1980-01-01,7
USGS,09259990,"SAND WASH NEAR SUNBEAM, CO.",ST,40.6199668,-108.3689852,S,NAD83,5790,15,NGVD29,14050003,pk,NA,NA,0,NA,wat,NA,0,0,1988-03-21,1990-06-12,3
USGS,09260000,"LITTLE SNAKE RIVER NEAR LILY, CO",ST,40.54901667,-108.4243222,5,NAD83,5685,15,NGVD29,14050003,pk,NA,NA,0,NA,wat,NA,0,0,1922-05-28,2023-05-17,102
USGS,09260050,"YAMPA RIVER AT DEERLODGE PARK, CO",ST,40.45163387,-108.525101,F,NAD83,5600,15,NGVD29,14050002,pk,NA,NA,0,NA,wat,NA,0,0,1982-05-07,2023-05-18,40
USGS,09261000,"GREEN RIVER NEAR JENSEN, UT",ST,40.40940757,-109.2354043,F,NAD83,4761.82,0.16,NAVD88,14060001,pk,NA,NA,0,NA,wat,NA,0,0,1904-05-29,2023-05-18,79
USGS,09261700,"BIG BRUSH CRK ABV RED FLEET RES, NR VERNAL, UT",ST,40.58884837,-109.4654138,F,NAD83,5630.26,0.1,NAVD88,14060002,pk,NA,NA,0,NA,wat,NA,0,0,1980-05-23,2023-05-26,44
USGS,09262000,"BIG BRUSH CREEK NEAR VERNAL,UTAH",ST,40.58162648,-109.4348572,F,NAD83,5530,20,NGVD29,14060002,pk,NA,NA,0,NA,wat,NA,0,0,1939-05-06,1979-05-23,41
USGS,09263000,"LITTLE BRUSH CREEK NR VERNAL, UT",ST,40.7160695,-109.5056942,F,NAD83,8000,20,NGVD29,14060002,pk,NA,NA,0,NA,wat,NA,0,0,1946-04-25,1952-05-08,7
USGS,09263500,"BRUSH CREEK NEAR JENSEN, UTAH",ST,40.4085734,-109.3409634,F,NAD83,4730,20,NGVD29,14060002,pk,NA,NA,0,NA,wat,NA,0,0,1940-05-25,1965-06-11,26
USGS,09263700,"CLIFF CREEK NEAR JENSEN, UTAH",ST,40.299965,-109.1340103,F,NAD83,5270,20,NGVD29,14060001,pk,NA,NA,0,NA,wat,NA,0,0,1960-08-23,1974-01-01,15
USGS,09263800,"COW WASH NEAR JENSEN, UTAH",ST,40.3166307,-109.2173467,F,NAD83,5110,20,NGVD29,14060001,pk,NA,NA,0,NA,wat,NA,0,0,1960-09-16,1974-01-01,14
USGS,09264000,"ASHLEY C BELOW TROUT C NR VERNAL, UTAH",ST,40.73329,-109.6784789,F,NAD83,9200,20,NGVD29,14060002,pk,NA,NA,0,NA,wat,NA,0,0,1944-05-30,1954-05-09,11
USGS,09264500,"SOUTH FORK ASHLEY C NR VERNAL, UTAH",ST,40.7332898,-109.7034799,F,NAD83,9360,20,NGVD29,14060002,pk,NA,NA,0,NA,wat,NA,0,0,1944-06-26,1955-05-20,12
USGS,09265300,"ASHLEY CREEK ABOVE RED PINE CREEK NR VERNAL, UT",ST,40.6796794,-109.6609775,F,NAD83,7870.03,20,NGVD29,14060002,pk,NA,NA,0,NA,wat,NA,0,0,1965-06-10,1975-06-15,11
USGS,09265500,ASHLEY CR ABV SP NR VERNAL UT,ST,40.58884697,-109.6229194,F,NAD83,6300,20,NGVD29,14060002,pk,NA,NA,0,NA,wat,NA,0,0,2013-07-05,2015-06-01,3
USGS,09266500,"ASHLEY CREEK NEAR VERNAL, UT",ST,40.57745816,-109.6220859,F,NAD83,6230.61,20,NGVD29,14060002,pk,NA,NA,0,NA,wat,NA,0,0,1912-05-27,2023-05-24,111
USGS,09267100,"ASHLEY CREEK ABOVE DRY FORK, NR VERNAL, UTAH",ST,40.53773628,-109.6098627,F,NAD83,5910,20,NGVD29,14060002,pk,NA,NA,0,NA,wat,NA,0,0,1969-06-16,1972-05-16,4
USGS,09268000,"DRY FORK ABOVE SINKS, NEAR DRY FORK, UTAH",ST,40.6263445,-109.8201488,F,NAD83,8108.51,20,NGVD29,14060002,pk,NA,NA,0,NA,wat,NA,0,0,1939-09-13,1975-06-15,37
USGS,09268500,"NORTH FORK OF DRY FORK NEAR DRY FORK, UTAH",ST,40.6427334,-109.810982,F,NAD83,8284.28,20,NGVD29,14060002,pk,NA,NA,0,NA,wat,NA,0,0,1946-04-25,1989-04-21,44
USGS,09268900,"BROWNIE CANYON ABOVE SINKS, NR DRY FORK, UTAH",ST,40.65940095,-109.7509807,F,NAD83,8300,20,NGVD29,14060002,pk,NA,NA,0,NA,wat,NA,0,0,1961-05-29,1989-04-22,29
USGS,09269000,"EAST FORK OF DRY FORK NEAR DRY FORK, UTAH",ST,40.64995639,-109.7618142,F,NAD83,8150,20,NGVD29,14060002,pk,NA,NA,0,NA,wat,NA,0,0,1946-05-05,1963-05-17,18
USGS,09270000,"DRY FORK BELOW SPRINGS NEAR DRY FORK, UTAH",ST,40.56940199,-109.6976441,F,NAD83,6706.95,20,NGVD29,14060002,pk,NA,NA,0,NA,wat,NA,0,0,1904-05-22,1969-05-21,22
USGS,09270500,"DRY FORK AT MOUTH NEAR DRY FORK, UTAH",ST,40.5263475,-109.6056958,F,NAD83,5842.9,20,NGVD29,14060002,pk,NA,NA,0,NA,wat,NA,0,0,1955-08-25,1989-02-22,35
